{
  "$schema": "../../../../docs/architecture/schemas/plugin.schema.json",
  "id": "estate-race-player",
  "gameId": "estate-race",
  "apiVersion": "2.0",
  "targets": {
    "player-web": {
      "entry": "src/index.ts",
      "contributes": { "phaserSceneFactory": true }
    }
  },
  "validation": { "typecheck": "typecheck", "test": "test" },
  "permissions": {
    "network": false,
    "filesystem": "plugin-root-only",
    "environment": []
  },
  "dependenciesPolicy": "platform-only"
}
